[
  {
    "from": "vercy.plmm",
    "to": "vercy.aismm",
    "edge_type": "composes",
    "declared_min": "3.1.0",
    "compositional_role": "R2",
    "kinds": [
      "software-product",
      "entity"
    ],
    "fingerprint_at_registration": "mufp:9f2c47d1a83e50b6",
    "declared_by": "vercy.plmm",
    "observed_at": "2026-08-10T00:00:00Z",
    "note": "PLMM orchestrates AISMM by reference, never by inclusion. edge_type is the relationship kind; compositional_role binds how the target participates to ARCH-016 (semantics not restated here). declared_min is the sole input to Minimal Version Selection and equals the matching software-product and entity min_version entries in plmm's requires. Every kind here appears in the target's exports (CI export coverage). Any upper bound PLMM cares about lives in version_range as a publish-time V-gate predicate, not a resolver input."
  },
  {
    "from": "vercy.plmm",
    "to": "vercy.apmm",
    "edge_type": "references",
    "declared_min": "0.1.0",
    "compositional_role": "R4",
    "kinds": [
      "role",
      "task"
    ],
    "fingerprint_at_registration": "mufp:4b8e21c9d05f7a36",
    "declared_by": "vercy.plmm",
    "observed_at": "2026-08-10T00:00:00Z",
    "note": "PLMM refers to kinds declared in APMM's exports, named in this edge's kinds field and checked by CI export coverage. Reference only: APMM stays independently owned and versioned, and only APMM defines semantics for identifiers in its namespace (ARCH-018 as a reasoning rule). declared_min equals the matching role and task min_version entries in plmm's requires."
  },
  {
    "from": "vercy.plmm",
    "to": "vercy.oumm",
    "edge_type": "references",
    "declared_min": "0.1.0",
    "compositional_role": "R4",
    "kinds": [
      "org-unit"
    ],
    "fingerprint_at_registration": "mufp:b7f4e2a10c93d856",
    "declared_by": "vercy.plmm",
    "observed_at": "2026-08-10T12:00:00Z",
    "note": "PLMM's Business Unit is an org-unit; PLMM references the OUMM org-unit kind rather than re-defining it."
  },
  {
    "from": "vercy.ccmm",
    "to": "vercy.apmm",
    "edge_type": "references",
    "declared_min": "0.1.0",
    "compositional_role": "R4",
    "kinds": [
      "role",
      "knowledge-item"
    ],
    "fingerprint_at_registration": "mufp:4b8e21c9d05f7a36",
    "declared_by": "vercy.ccmm",
    "observed_at": "2026-08-10T12:00:00Z",
    "note": "The Agent Core's portable knowledge and the Role are APMM kinds the chain references, not re-defines."
  },
  {
    "from": "vercy.ccmm",
    "to": "vercy.oumm",
    "edge_type": "references",
    "declared_min": "0.1.0",
    "compositional_role": "R4",
    "kinds": [
      "org-unit"
    ],
    "fingerprint_at_registration": "mufp:b7f4e2a10c93d856",
    "declared_by": "vercy.ccmm",
    "observed_at": "2026-08-10T12:00:00Z",
    "note": "The Role Context's Org is an OUMM org-unit."
  },
  {
    "from": "deploy.portfolio",
    "to": "deploy.aismm-product",
    "edge_type": "composes",
    "declared_min": "0.1.0",
    "compositional_role": "R2",
    "kinds": [
      "software-product",
      "entity"
    ],
    "fingerprint_at_registration": "mufp:de91073d0c7a5b46",
    "declared_by": "deploy.portfolio",
    "observed_at": "2026-08-10T12:00:00Z",
    "note": "Illustrative instance edge: the deployment site's portfolio orchestrates its own AISMM product by reference, closing AISMM to PLMM at instance grain. declared_min equals the matching software-product and entity min_version entries in deploy.portfolio's requires; both kinds appear in deploy.aismm-product's exports (CI export coverage). No new edge type: this is the existing composes vocabulary."
  },
  {
    "from": "deploy.portfolio",
    "to": "vercy.oumm",
    "edge_type": "references",
    "declared_min": "0.1.0",
    "compositional_role": "R4",
    "kinds": [
      "org-unit"
    ],
    "fingerprint_at_registration": "mufp:b7f4e2a10c93d856",
    "declared_by": "deploy.portfolio",
    "observed_at": "2026-08-10T12:00:00Z",
    "note": "The deployment site's portfolio references the owning org-unit; each product entry names its owning oumm.org-unit id as a Finding in the Relationships layer. Reference only: OUMM stays independently owned and is not re-defined here."
  },
  {
    "from": "vercy.collective",
    "to": "vercy.oumm",
    "edge_type": "references",
    "declared_min": "0.1.0",
    "compositional_role": "R4",
    "kinds": [
      "org-unit"
    ],
    "fingerprint_at_registration": "mufp:b7f4e2a10c93d856",
    "declared_by": "vercy.collective",
    "observed_at": "2026-08-10T12:00:00Z",
    "note": "The Collective model relates to organizational units (its own world-models mapping resolves a collective of kind organizationalUnit to world.organizationalUnit). Here it references the governed OUMM org-unit kind for the parent unit and member seats, rather than re-defining organizational structure."
  },
  {
    "from": "vercy.plmm",
    "to": "vercy.collective",
    "edge_type": "references",
    "declared_min": "0.2.0",
    "compositional_role": "R4",
    "kinds": [
      "collective"
    ],
    "fingerprint_at_registration": "mufp:cb346c3d019a37ef",
    "declared_by": "vercy.plmm",
    "observed_at": "2026-08-10T12:00:00Z",
    "note": "PLMM records which team builds each product by referencing the canonical Collective Meta-Model (github.com/ver-cy/collective-meta-model) on the collective kind, closing Collective to product at the portfolio grain. Reference only: the Collective model stays sovereign and is not re-defined."
  },
  {
    "from": "vercy.enterprise-landscape",
    "to": "vercy.aismm",
    "edge_type": "composes",
    "declared_min": "3.1.0",
    "compositional_role": "R2",
    "kinds": [
      "entity"
    ],
    "fingerprint_at_registration": "mufp:9f2c47d1a83e50b6",
    "declared_by": "vercy.enterprise-landscape",
    "observed_at": "2026-08-12T00:00:00Z",
    "note": "The Enterprise Landscape orchestrates the software Core by reference, never by inclusion. declared_min equals the entity min_version in this node requires; entity appears in vercy.aismm exports (CI export coverage). Any upper bound is a publish-time V-gate predicate, not a resolver input."
  },
  {
    "from": "vercy.enterprise-landscape",
    "to": "vercy.plmm",
    "edge_type": "composes",
    "declared_min": "0.2.0",
    "compositional_role": "R6",
    "kinds": [
      "product",
      "capability"
    ],
    "fingerprint_at_registration": "mufp:c31d75e8a92b40f6",
    "declared_by": "vercy.enterprise-landscape",
    "observed_at": "2026-08-12T00:00:00Z",
    "note": "Landscape-composes-Landscape (ARCH-016 R6): the product Landscape participates as an aggregate substructure of the enterprise landscape. composes stays acyclic (enterprise-landscape composes plmm and aismm; plmm composes aismm; no cycle). declared_min equals the product and capability min_version entries in this node requires; both kinds appear in vercy.plmm exports."
  }
]
